<?xml version='1.0' encoding='utf-8'?>

<!ELEMENT mapping (entry*)>

<!ELEMENT entry (description?,entry-class?,oc*,at*,source*,link?,handler?,engine?,aci*,parameter*,init?,add?,bind?,compare?,delete?,modify?,modrdn?,search?,unbind?,destroy?)>
<!ATTLIST entry dn CDATA "">
<!ATTLIST entry enabled CDATA #IMPLIED>
<!ATTLIST entry attached CDATA #IMPLIED>
<!ATTLIST entry id CDATA #IMPLIED>
<!ATTLIST entry parentId CDATA #IMPLIED>
<!ELEMENT entry-class (#PCDATA)>
<!ELEMENT init (#PCDATA)>
<!ELEMENT add (#PCDATA)>
<!ELEMENT bind (#PCDATA)>
<!ELEMENT compare (#PCDATA)>
<!ELEMENT delete (#PCDATA)>
<!ELEMENT modify (#PCDATA)>
<!ELEMENT modrdn (#PCDATA)>
<!ELEMENT search (#PCDATA)>
<!ELEMENT unbind (#PCDATA)>
<!ELEMENT destroy (#PCDATA)>

<!ELEMENT description (#PCDATA)>

<!ELEMENT oc (#PCDATA)>

<!ELEMENT at (binary|constant|variable|expression)>
<!ATTLIST at name CDATA #REQUIRED>
<!ATTLIST at rdn (true|first|false) "false">
<!ATTLIST at operational (true|false) "false">

<!ELEMENT source (source-name,field*,parameter*)>
<!ATTLIST source name CDATA #REQUIRED>
<!ATTLIST source readOnly CDATA #IMPLIED>
<!ATTLIST source engine CDATA #IMPLIED>
<!ATTLIST source required CDATA #IMPLIED>
<!ATTLIST source add CDATA #IMPLIED>
<!ATTLIST source bind CDATA #IMPLIED>
<!ATTLIST source delete CDATA #IMPLIED>
<!ATTLIST source modify CDATA #IMPLIED>
<!ATTLIST source modrdn CDATA #IMPLIED>
<!ATTLIST source search CDATA #IMPLIED>
<!ELEMENT source-name (#PCDATA)>

<!ELEMENT field (binary|constant|variable|expression)>
<!ATTLIST field name CDATA #REQUIRED>
<!ATTLIST field primaryKey (true|first|false) "false">

<!ELEMENT binary (#PCDATA)>
<!ELEMENT constant (#PCDATA)>
<!ELEMENT variable (#PCDATA)>
<!ELEMENT expression (#PCDATA)>
<!ATTLIST expression foreach CDATA #IMPLIED>
<!ATTLIST expression var CDATA #IMPLIED>

<!ELEMENT link (dn?,partition?)>

<!ELEMENT partition (#PCDATA)>
<!ELEMENT handler (#PCDATA)>
<!ELEMENT engine (#PCDATA)>

<!ELEMENT aci (dn?,target?,attributes?,scope?,action?,permission)>
<!ATTLIST aci subject CDATA #IMPLIED>
<!ELEMENT dn (#PCDATA)>
<!ELEMENT target (#PCDATA)>
<!ELEMENT attributes (#PCDATA)>
<!ELEMENT scope (#PCDATA)>
<!ELEMENT action (#PCDATA)>
<!ELEMENT permission (#PCDATA)>

<!ELEMENT parameter (param-name, param-value)>
<!ELEMENT param-name (#PCDATA)>
<!ELEMENT param-value (#PCDATA)>
