<?xml version="1.0" encoding="UTF-8"?>
<!DOCTYPE mapping PUBLIC
  "-//Penrose/DTD Mapping ${product.specification}//EN"
  "http://penrose.safehaus.org/dtd/mapping.dtd">

<mapping>

  <entry dn="dc=LDAP Cache,dc=Example,dc=com">
    <oc>dcObject</oc>
    <oc>organization</oc>
    <at name="dc" rdn="true">
      <constant>LDAP Cache</constant>
    </at>
    <at name="o">
      <constant>LDAP Cache</constant>
    </at>
    <aci subject="self">
      <permission>rws</permission>
    </aci>
    <aci>
      <target>ATTRIBUTES</target>
      <attributes>userPassword</attributes>
      <action>deny</action>
      <permission>rs</permission>
    </aci>
    <aci>
      <permission>rs</permission>
    </aci>
  </entry>

  <entry dn="ou=Users,dc=LDAP Cache,dc=Example,dc=com">
    <oc>organizationalUnit</oc>
    <at name="ou" rdn="true">
      <constant>Users</constant>
    </at>
  </entry>

  <entry dn="uid=...,ou=Users,dc=LDAP Cache,dc=Example,dc=com">
    <oc>person</oc>
    <oc>organizationalPerson</oc>
    <oc>inetOrgPerson</oc>
    <at name="uid" rdn="true">
      <variable>u.uid</variable>
    </at>
    <at name="cn">
      <variable>u.cn</variable>
    </at>
    <at name="sn">
      <variable>u.sn</variable>
    </at>
    <at name="userPassword">
      <variable>u.userPassword</variable>
    </at>
    <source name="u">
      <source-name>users</source-name>
      <field name="uid">
        <variable>uid</variable>
      </field>
      <field name="cn">
        <variable>cn</variable>
      </field>
      <field name="sn">
        <variable>sn</variable>
      </field>
      <field name="userPassword">
        <variable>userPassword</variable>
      </field>
    </source>
  </entry>

  <entry dn="ou=Groups,dc=LDAP Cache,dc=Example,dc=com">
    <oc>organizationalUnit</oc>
    <at name="ou" rdn="true">
      <constant>Groups</constant>
    </at>
  </entry>

  <entry dn="cn=...,ou=Groups,dc=LDAP Cache,dc=Example,dc=com">
    <oc>groupOfUniqueNames</oc>
    <at name="cn" rdn="true">
      <variable>g.groupname</variable>
    </at>
    <at name="uniqueMember">
      <expression foreach="ug.username" var="username">
return "uid="+username+",ou=Users,dc=LDAP Cache,dc=Example,dc=com";
      </expression>
    </at>
    <source name="g">
      <source-name>groups_cache</source-name>
      <field name="groupname">
        <variable>cn</variable>
      </field>
    </source>
    <source name="ug">
      <source-name>usergroups_cache</source-name>
      <field name="groupname">
        <variable>g.groupname</variable>
      </field>
      <field name="username">
        <expression foreach="uniqueMember" var="um">
int i=um.indexOf("=");
int j=um.indexOf(",");
return um.substring(i+1, j);
        </expression>
      </field>
    </source>
  </entry>

</mapping>
