<?xml version="1.0" encoding="UTF-8"?>
<!DOCTYPE mapping PUBLIC
  "-//Penrose/DTD Mapping ${product.specification}//EN"
  "http://penrose.safehaus.org/dtd/mapping.dtd">

<mapping>

  <entry dn="${LDAP_SUFFIX}">
    <entry-class>org.safehaus.penrose.directory.ProxyEntry</entry-class>
    <source>
      <source-name>LDAP</source-name>
    </source>
    <aci subject="self">
      <permission>rws</permission>
    </aci>
    <aci>
      <target>ATTRIBUTES</target>                                   
      <attributes>userPassword</attributes>
      <action>deny</action>
      <permission>rs</permission>
    </aci>
    <aci>
      <permission>rs</permission>
    </aci>
  </entry>

</mapping>
