<?xml version="1.0" encoding="UTF-8"?>
<!DOCTYPE mapping PUBLIC
  "-//Penrose/DTD Mapping ${product.specification}//EN"
  "http://penrose.safehaus.org/dtd/mapping.dtd">

<mapping>

  <entry dn="dc=JDBC Cache,dc=Example,dc=com">
    <oc>dcObject</oc>
    <oc>organization</oc>
    <at name="dc" rdn="true">
      <constant>JDBC Cache</constant>
    </at>
    <at name="o">
      <constant>JDBC Cache</constant>
    </at>
    <aci subject="self">
      <permission>rws</permission>
    </aci>
    <aci>
      <target>ATTRIBUTES</target>
      <attributes>userPassword</attributes>
      <action>deny</action>
      <permission>rs</permission>
    </aci>
    <aci>
      <permission>rs</permission>
    </aci>
  </entry>

  <entry dn="ou=Users,dc=JDBC Cache,dc=Example,dc=com">
    <oc>organizationalUnit</oc>
    <at name="ou" rdn="true">
      <constant>Users</constant>
    </at>
  </entry>

  <entry dn="uid=...,ou=Users,dc=JDBC Cache,dc=Example,dc=com">
    <oc>person</oc>
    <oc>organizationalPerson</oc>
    <oc>inetOrgPerson</oc>
    <at name="uid" rdn="true">
      <variable>u.uid</variable>
    </at>
    <at name="cn">
      <variable>u.cn</variable>
    </at>
    <at name="sn">
      <variable>u.sn</variable>
    </at>
    <at name="userPassword">
      <variable>u.userPassword</variable>
    </at>
    <source name="u">
      <source-name>cache_users</source-name>
      <field name="uid">
        <variable>uid</variable>
      </field>
      <field name="cn">
        <variable>cn</variable>
      </field>
      <field name="sn">
        <variable>sn</variable>
      </field>
      <field name="userPassword">
        <variable>userPassword</variable>
      </field>
    </source>
  </entry>

  <entry dn="ou=Groups,dc=JDBC Cache,dc=Example,dc=com">
    <oc>organizationalUnit</oc>
    <at name="ou" rdn="true">
      <constant>Groups</constant>
    </at>
  </entry>

  <entry dn="cn=...,ou=Groups,dc=JDBC Cache,dc=Example,dc=com">
    <oc>groupOfUniqueNames</oc>
    <at name="cn" rdn="true">
      <variable>g.cn</variable>
    </at>
    <at name="uniqueMember">
      <variable>ug.uniqueMember</variable>
    </at>
    <source name="g">
      <source-name>cache_groups</source-name>
      <field name="cn">
        <variable>cn</variable>
      </field>
    </source>
    <source name="ug">
      <source-name>cache_usergroups</source-name>
      <field name="cn">
        <variable>g.cn</variable>
      </field>
      <field name="uniqueMember">
        <variable>uniqueMember</variable>
      </field>
    </source>
  </entry>

</mapping>
